{
  "action_style": null,
  "camera_style": null,
  "chibi_insertions": null,
  "continuity_rule": "strict_story_truth",
  "full_chibi_scene": false,
  "humor_level": null,
  "inner_monologue": null,
  "performance_style": null,
  "preset_id": null,
  "profile_id": null,
  "profile_status": "STYLE_UNRESOLVED",
  "project_id": "UNRESOLVED",
  "realism_level": null,
  "revision": 1,
  "selected_by": "UNRESOLVED",
  "source_refs": [],
  "state_scope": "PORTABLE_WEB_STATE_ONLY",
  "tone": null,
  "vfx_policy": null,
  "visual_type": null
}
